{
  "$schema": "https://json-schema.org/draft/2020-12/schema",
  "title": "merchant_coupon",
  "type": "object",
  "additionalProperties": false,
  "properties": {
    "id": { "type": "string" },
    "status": { "type": "string" },
    "created_at": { "type": "string" },
    "updated_at": { "type": "string" },
    "owner_scope": { "type": "string" },
    "coupon_id": { "type": "string" },
    "coupon_name": { "type": "string" },
    "activity_id": { "type": "string" },
    "activity_name": { "type": "string" },
    "status_label": { "type": "string" },
    "issued_count": { "type": "number" },
    "claimed_count": { "type": "number" },
    "redeemed_count": { "type": "number" },
    "unredeemed_count": { "type": "number" },
    "redemption_rate": { "type": "number" },
    "valid_from": { "type": "string" },
    "valid_to": { "type": "string" },
    "redemption_records": { "type": "array" }
  },
  "required": ["id", "status", "created_at", "updated_at", "owner_scope", "coupon_id", "coupon_name", "activity_id", "activity_name", "status_label", "issued_count", "claimed_count", "redeemed_count", "unredeemed_count", "redemption_rate", "valid_from", "valid_to", "redemption_records"]
}
